{
  "$schema": "http://json-schema.org/draft-07/schema#",
  "$id": "https://github.com/quorum-dev/quorum/raw/main/quorum.config.schema.json",
  "title": "Quorum Project Config",
  "description": "Configuration file for a Quorum project. Place this file at configs/<group_id>.json in your S3 bucket. Quorum uses it to scope the knowledge graph, enforce governance, and identify team members.",
  "type": "object",
  "required": ["group_id"],
  "additionalProperties": false,
  "properties": {

    "group_id": {
      "type": "string",
      "minLength": 1,
      "pattern": "^[a-z0-9-]+$",
      "description": "Canonical identifier for this project. Must be unique across your Quorum stack. Used as: (1) S3 key prefix — s3://<bucket>/<group_id>/config.json, (2) DynamoDB primary key in quorum-configs and quorum-user-projects, (3) JWT 'project' claim that scopes all graph and audit operations, (4) Graphiti group_id that namespaces the knowledge graph. Must match the filename: configs/<group_id>.json. Lowercase letters, numbers, and hyphens only — no spaces.",
      "examples": ["platform-team", "backend-api", "my-project"]
    },

    "project": {
      "type": "string",
      "minLength": 1,
      "description": "Human-readable display name shown in the dashboard project picker. Optional — falls back to group_id if not set. Unlike group_id, this may contain spaces and mixed case. Never used as a lookup key.",
      "examples": ["Platform Team", "Backend API", "My Project"]
    },

    "members": {
      "type": "array",
      "description": "Team roster. Each member needs at least one identity signal (github_username or git_email) so Quorum can attribute knowledge nodes and compute authority weights.",
      "default": [],
      "items": {
        "$ref": "#/$defs/Member"
      }
    },

    "roles": {
      "type": "object",
      "description": "Role definitions that control base_confidence floors. Every role name used in 'members[].role' must appear here. Roles not listed default to base_confidence 0.5.",
      "default": {},
      "additionalProperties": {
        "$ref": "#/$defs/Role"
      },
      "examples": [
        {
          "principal_architect": { "base_confidence": 0.90 },
          "senior_engineer":     { "base_confidence": 0.80 },
          "engineer":            { "base_confidence": 0.70 },
          "junior":              { "base_confidence": 0.60 }
        }
      ]
    },

    "domains": {
      "type": "object",
      "description": "Per-domain governance overrides. Domains segment your knowledge graph by area of concern (e.g. 'auth', 'infra', 'payments'). Each domain can tighten the conflict threshold and restrict which teams may review knowledge in that domain. Domains not listed here inherit the global thresholds.",
      "default": {},
      "additionalProperties": {
        "$ref": "#/$defs/DomainConfig"
      },
      "examples": [
        {
          "auth": {
            "conflict_threshold": 0.90,
            "required_reviewer_teams": ["security"]
          },
          "infra": {
            "conflict_threshold": 0.88,
            "required_reviewer_teams": ["platform"]
          }
        }
      ]
    },

    "thresholds": {
      "$ref": "#/$defs/Thresholds",
      "description": "Global governance thresholds. Domain-level conflict_threshold overrides take precedence over this global value."
    },

    "notifications": {
      "$ref": "#/$defs/Notifications",
      "description": "Webhook notification config (GAP-17). When a conflict lands in the human review queue, Quorum POSTs a structured JSON payload to webhook_url. Wire it to Slack, an email relay, or PagerDuty."
    },

    "guest_access": {
      "type": "boolean",
      "default": false,
      "description": "When true, any GitHub-authenticated user can browse this project's knowledge graph in read-only guest mode. Guests have role: null — they see the dashboard but all writes are forced to DRAFT and they have no authority weight."
    }
  },

  "$defs": {

    "Member": {
      "type": "object",
      "title": "Team Member",
      "description": "A single team member record. Maps identity signals to a role so Quorum can attribute knowledge nodes to real people and compute authority weights.",
      "required": ["name", "team", "role"],
      "additionalProperties": false,
      "properties": {
        "name": {
          "type": "string",
          "minLength": 1,
          "description": "Display name shown in the dashboard audit trail and conflict resolution UI.",
          "examples": ["Alice Smith", "Bob Jones"]
        },
        "team": {
          "type": "string",
          "minLength": 1,
          "description": "Team or squad this member belongs to. Used for domain-level required_reviewer_teams checks — a reviewer satisfies the requirement when their team is in the domain's required_reviewer_teams list.",
          "examples": ["platform", "backend", "security"]
        },
        "role": {
          "type": "string",
          "minLength": 1,
          "description": "The member's role key. Must match a key in the top-level 'roles' map. Controls the base_confidence floor applied to this member's knowledge contributions.",
          "examples": ["principal_architect", "senior_engineer", "engineer", "junior"]
        },
        "github_username": {
          "type": "string",
          "description": "GitHub username (case-sensitive). Primary identity signal when QUORUM_GITHUB_TOKEN is configured — used to verify the user's GitHub identity at login. Must exactly match the login returned by GET https://api.github.com/user.",
          "examples": ["alice-gh", "bobsmith"]
        },
        "git_email": {
          "type": "string",
          "format": "email",
          "description": "Git committer email. Used as a fallback identity signal when GitHub verification is unavailable, and as the author identity on MCP-originated knowledge nodes.",
          "examples": ["alice@example.com", "bob@company.com"]
        }
      }
    },

    "Role": {
      "type": "object",
      "title": "Role Definition",
      "description": "Defines the base_confidence floor for a role. Author-provided confidence below this floor is raised to the floor value before the node is written to the graph.",
      "required": ["base_confidence"],
      "additionalProperties": false,
      "properties": {
        "base_confidence": {
          "type": "number",
          "minimum": 0,
          "maximum": 1,
          "description": "Confidence floor for this role (0–1). A principal_architect's writes are inherently more authoritative than a junior's — set this to reflect your team's trust hierarchy. Typical values: 0.90 (principal), 0.80 (senior), 0.70 (engineer), 0.60 (junior).",
          "examples": [0.90, 0.80, 0.70, 0.60]
        }
      }
    },

    "DomainConfig": {
      "type": "object",
      "title": "Domain Config",
      "description": "Per-domain governance overrides. Use stricter conflict_threshold values for sensitive domains (auth, payments, infra) where conflicting knowledge is more dangerous.",
      "additionalProperties": false,
      "properties": {
        "conflict_threshold": {
          "type": "number",
          "minimum": 0,
          "maximum": 1,
          "description": "Semantic similarity threshold above which two knowledge nodes in this domain are flagged as potentially conflicting (0–1). Overrides the global thresholds.conflict_threshold for this domain only. Use higher values (0.88–0.95) for sensitive domains to catch near-duplicates that might represent contradictory guidance.",
          "examples": [0.90, 0.88, 0.92]
        },
        "required_reviewer_teams": {
          "type": "array",
          "items": {
            "type": "string"
          },
          "description": "Teams whose members are permitted to review and resolve knowledge conflicts in this domain. A reviewer satisfies the requirement when their 'team' field matches any entry here. Empty array (or field omitted) = any team member may review.",
          "examples": [["security"], ["platform"], ["security", "platform"]]
        }
      }
    },

    "Thresholds": {
      "type": "object",
      "title": "Global Thresholds",
      "description": "Global governance thresholds used when no domain-level override is set.",
      "additionalProperties": false,
      "properties": {
        "conflict_threshold": {
          "type": "number",
          "minimum": 0,
          "maximum": 1,
          "default": 0.85,
          "description": "Global semantic similarity threshold for conflict detection (0–1). Two knowledge nodes above this threshold are flagged as potentially conflicting and sent to the review queue. Start at 0.85 and tune once you have real data — higher values = fewer (but higher-confidence) conflicts.",
          "examples": [0.85, 0.80, 0.90]
        },
        "authority_threshold": {
          "type": "number",
          "minimum": 0,
          "maximum": 1,
          "default": 0.20,
          "description": "Authority delta above which a conflict is auto-resolved in favour of the higher-authority author (0–1). When |authority_A - authority_B| > this value, Quorum resolves automatically without human review. Start at 0.20 — lower values auto-resolve more aggressively; higher values send more conflicts to humans.",
          "examples": [0.20, 0.15, 0.30]
        }
      }
    },

    "Notifications": {
      "type": "object",
      "title": "Notification Config",
      "description": "Webhook notification settings (GAP-17). Quorum fires a POST to webhook_url whenever a conflict enters the human review queue.",
      "additionalProperties": false,
      "properties": {
        "webhook_url": {
          "type": "string",
          "format": "uri",
          "description": "HTTP(S) URL to POST when a conflict.pending_review event fires. Quorum sends a JSON payload: { event, project_id, conflict_id, dashboard_url, actors, summary }. Wire this to a Slack incoming webhook, email relay, or PagerDuty Events API endpoint.",
          "examples": ["https://hooks.slack.com/services/T.../B.../...", "https://events.pagerduty.com/v2/enqueue"]
        },
        "dashboard_url": {
          "type": "string",
          "format": "uri",
          "description": "Override for the dashboard base URL used to build the deep-link in the webhook payload. Defaults to QUORUM_DASHBOARD_URL env var. Set this if your team accesses the dashboard at a non-default URL.",
          "examples": ["https://quorum.internal.example.com", "https://quorum.yourcompany.com"]
        }
      }
    }

  }
}
